{
  "schema_version": "1.0.0",
  "contract_id": "contract_fixture_price_cmp_01",
  "source_document_ids": ["srcdoc_fixture_price_cmp_01"],
  "contract_number": "SYN-PRICE-CMP-01",
  "notice_id": "notice_fixture_price_cmp_01",
  "award_id": "award_fixture_price_cmp_01",
  "agency": {
    "agency_id": "agency_fixture_cmp_01",
    "name": "가상비교기관01",
    "identity_status": "VERIFIED"
  },
  "supplier": {
    "supplier_id": "supplier_fixture_cmp_01",
    "name": "가상비교업체01",
    "entity_type": "CORPORATION",
    "identity_status": "VERIFIED",
    "business_number_last4": "0001"
  },
  "contract_type": "GOODS",
  "method": "OPEN_COMPETITION",
  "method_basis": "합성 fixture의 계약 방법 설명",
  "signed_at": "2025-01-03",
  "starts_at": "2025-01-03",
  "ends_at": "2026-05-31",
  "status": "ACTIVE",
  "amounts": {
    "original": {
      "currency": "KRW",
      "amount_minor": 4200000,
      "vat_basis": "INCLUDED"
    },
    "current": {
      "currency": "KRW",
      "amount_minor": 4200000,
      "vat_basis": "INCLUDED"
    }
  },
  "line_items": [
    {
      "line_item_id": "line_fixture_price_cmp_01_1",
      "line_number": 1,
      "raw_description": "합성 안전 단말기 S1 단품",
      "category_code": "SYNTH-SAFETY-DEVICE",
      "manufacturer": "가상제조사",
      "model": "S1",
      "variant": null,
      "quantity": "10",
      "unit_code": "EA",
      "unit_price": {
        "currency": "KRW",
        "amount_minor": 420000,
        "vat_basis": "INCLUDED"
      },
      "total_price": {
        "currency": "KRW",
        "amount_minor": 4200000,
        "vat_basis": "INCLUDED"
      },
      "vat_basis": "INCLUDED",
      "bundle_status": "SINGLE_ITEM",
      "specification": {
        "grade": "S1",
        "certification": "BASIC",
        "warranty_months": 12,
        "synthetic": true
      },
      "included_services": [],
      "normalization_confidence": 0.99
    }
  ],
  "field_provenance": {
    "contract_number": {
      "source_document_id": "srcdoc_fixture_price_cmp_01",
      "locator": {
        "type": "API_FIELD",
        "value": "$.contractNumber"
      },
      "raw_value_hash": "a75561d1adc424bf0fa1a2e4d5e02e46387b0a76192536f7ab47a5983326112b",
      "raw_value_preview": "SYN-PRICE-CMP-01",
      "parser_version": "fixture-parser-1.0.0",
      "transform_version": "fixture-normalizer-1.0.0",
      "confidence": 1.0
    },
    "agency.name": {
      "source_document_id": "srcdoc_fixture_price_cmp_01",
      "locator": {
        "type": "API_FIELD",
        "value": "$.agencyName"
      },
      "raw_value_hash": "9ae4a3aa0bd2fcf52fe42cc7f8f646f83e23fb1cb5029808e9482c5346f7af2a",
      "raw_value_preview": "가상비교기관01",
      "parser_version": "fixture-parser-1.0.0",
      "transform_version": "fixture-normalizer-1.0.0",
      "confidence": 1.0
    },
    "supplier.name": {
      "source_document_id": "srcdoc_fixture_price_cmp_01",
      "locator": {
        "type": "API_FIELD",
        "value": "$.supplierName"
      },
      "raw_value_hash": "a8d1ad3c1d94000c884e126e79ffa914eda5afd97997e1d47d3f30bb30c656b2",
      "raw_value_preview": "가상비교업체01",
      "parser_version": "fixture-parser-1.0.0",
      "transform_version": "fixture-normalizer-1.0.0",
      "confidence": 1.0
    },
    "amounts.current": {
      "source_document_id": "srcdoc_fixture_price_cmp_01",
      "locator": {
        "type": "API_FIELD",
        "value": "$.amount"
      },
      "raw_value_hash": "ceae22fafafd6ca5c78db71b6012b5feda3aa5041c03107bf3e5a96807fd93ad",
      "raw_value_preview": "4200000",
      "parser_version": "fixture-parser-1.0.0",
      "transform_version": "fixture-normalizer-1.0.0",
      "confidence": 1.0
    },
    "line_items[0].quantity": {
      "source_document_id": "srcdoc_fixture_price_cmp_01",
      "locator": {
        "type": "API_FIELD",
        "value": "$.items[0].quantity"
      },
      "raw_value_hash": "4a44dc15364204a80fe80e9039455cc1608281820fe2b24f1e5233ade6af1dd5",
      "raw_value_preview": "10",
      "parser_version": "fixture-parser-1.0.0",
      "transform_version": "fixture-normalizer-1.0.0",
      "confidence": 1.0
    },
    "line_items[0].unit_price": {
      "source_document_id": "srcdoc_fixture_price_cmp_01",
      "locator": {
        "type": "API_FIELD",
        "value": "$.items[0].unitPrice"
      },
      "raw_value_hash": "c74cc85badcf13b0d9704ec9f8645aee901600d4167e32d00527481fcb8aa25f",
      "raw_value_preview": "420000",
      "parser_version": "fixture-parser-1.0.0",
      "transform_version": "fixture-normalizer-1.0.0",
      "confidence": 1.0
    },
    "line_items[0].vat_basis": {
      "source_document_id": "srcdoc_fixture_price_cmp_01",
      "locator": {
        "type": "API_FIELD",
        "value": "$.items[0].vatBasis"
      },
      "raw_value_hash": "c77a4910d506fabde27cc281a5a48ed9e9a8f75f721eac77918ab30a3181b2be",
      "raw_value_preview": "INCLUDED",
      "parser_version": "fixture-parser-1.0.0",
      "transform_version": "fixture-normalizer-1.0.0",
      "confidence": 1.0
    }
  },
  "normalization_version": "1.0.0",
  "normalized_at": "2026-01-15T04:00:00Z"
}
