{
  "schema_version": "1.0.0",
  "contract_id": "contract_fixture_split_01",
  "source_document_ids": [
    "srcdoc_fixture_split_01"
  ],
  "contract_number": "SYN-SPLIT-01",
  "notice_id": "notice_fixture_split_01",
  "award_id": "award_fixture_split_01",
  "agency": {
    "agency_id": "agency_fixture_byeolbit",
    "name": "가상별빛구청",
    "identity_status": "VERIFIED"
  },
  "supplier": {
    "supplier_id": "supplier_fixture_omega",
    "name": "가상오메가용역",
    "entity_type": "CORPORATION",
    "identity_status": "VERIFIED",
    "business_number_last4": "0001"
  },
  "contract_type": "SERVICE",
  "method": "SOLE_SOURCE",
  "method_basis": "합성 fixture의 계약 방법 설명",
  "signed_at": "2025-08-03",
  "starts_at": "2025-08-03",
  "ends_at": "2026-05-31",
  "status": "ACTIVE",
  "amounts": {
    "original": {
      "currency": "KRW",
      "amount_minor": 49500000,
      "vat_basis": "INCLUDED"
    },
    "current": {
      "currency": "KRW",
      "amount_minor": 49500000,
      "vat_basis": "INCLUDED"
    }
  },
  "line_items": [
    {
      "line_item_id": "line_fixture_split_01_1",
      "line_number": 1,
      "raw_description": "합성 청사 데이터 정비 용역 1구간",
      "category_code": "SYNTH-DATA-CLEANING-SERVICE",
      "manufacturer": "가상제조사",
      "model": "S1",
      "variant": null,
      "quantity": "1",
      "unit_code": "LOT",
      "unit_price": {
        "currency": "KRW",
        "amount_minor": 49500000,
        "vat_basis": "INCLUDED"
      },
      "total_price": {
        "currency": "KRW",
        "amount_minor": 49500000,
        "vat_basis": "INCLUDED"
      },
      "vat_basis": "INCLUDED",
      "bundle_status": "SINGLE_ITEM",
      "specification": {
        "scope_family": "DATA-CLEANING",
        "district_segment": 1,
        "synthetic": true
      },
      "included_services": [],
      "normalization_confidence": 0.99
    }
  ],
  "field_provenance": {
    "contract_number": {
      "source_document_id": "srcdoc_fixture_split_01",
      "locator": {
        "type": "API_FIELD",
        "value": "$.contractNumber"
      },
      "raw_value_hash": "f04e62b921db26eeaba42d5178a1e61419c871aaa08f5c719acb09c0681b8ad8",
      "raw_value_preview": "SYN-SPLIT-01",
      "parser_version": "fixture-parser-1.0.0",
      "transform_version": "fixture-normalizer-1.0.0",
      "confidence": 1.0
    },
    "agency.name": {
      "source_document_id": "srcdoc_fixture_split_01",
      "locator": {
        "type": "API_FIELD",
        "value": "$.agencyName"
      },
      "raw_value_hash": "3bda14fc85b616bc39d77af31173dd275d3bc9a9017acfca0856c040dbaa1012",
      "raw_value_preview": "가상별빛구청",
      "parser_version": "fixture-parser-1.0.0",
      "transform_version": "fixture-normalizer-1.0.0",
      "confidence": 1.0
    },
    "supplier.name": {
      "source_document_id": "srcdoc_fixture_split_01",
      "locator": {
        "type": "API_FIELD",
        "value": "$.supplierName"
      },
      "raw_value_hash": "498362fa42644afbc88bbba2a84e635277c4189decc7565425f9ae8c5bf53e1d",
      "raw_value_preview": "가상오메가용역",
      "parser_version": "fixture-parser-1.0.0",
      "transform_version": "fixture-normalizer-1.0.0",
      "confidence": 1.0
    },
    "amounts.current": {
      "source_document_id": "srcdoc_fixture_split_01",
      "locator": {
        "type": "API_FIELD",
        "value": "$.amount"
      },
      "raw_value_hash": "38babe59043badf72081accbdf4b63cd4f480e0709782d583a2170d74320b7af",
      "raw_value_preview": "49500000",
      "parser_version": "fixture-parser-1.0.0",
      "transform_version": "fixture-normalizer-1.0.0",
      "confidence": 1.0
    },
    "line_items[0].quantity": {
      "source_document_id": "srcdoc_fixture_split_01",
      "locator": {
        "type": "API_FIELD",
        "value": "$.items[0].quantity"
      },
      "raw_value_hash": "6b86b273ff34fce19d6b804eff5a3f5747ada4eaa22f1d49c01e52ddb7875b4b",
      "raw_value_preview": "1",
      "parser_version": "fixture-parser-1.0.0",
      "transform_version": "fixture-normalizer-1.0.0",
      "confidence": 1.0
    },
    "line_items[0].unit_price": {
      "source_document_id": "srcdoc_fixture_split_01",
      "locator": {
        "type": "API_FIELD",
        "value": "$.items[0].unitPrice"
      },
      "raw_value_hash": "38babe59043badf72081accbdf4b63cd4f480e0709782d583a2170d74320b7af",
      "raw_value_preview": "49500000",
      "parser_version": "fixture-parser-1.0.0",
      "transform_version": "fixture-normalizer-1.0.0",
      "confidence": 1.0
    },
    "line_items[0].vat_basis": {
      "source_document_id": "srcdoc_fixture_split_01",
      "locator": {
        "type": "API_FIELD",
        "value": "$.items[0].vatBasis"
      },
      "raw_value_hash": "c77a4910d506fabde27cc281a5a48ed9e9a8f75f721eac77918ab30a3181b2be",
      "raw_value_preview": "INCLUDED",
      "parser_version": "fixture-parser-1.0.0",
      "transform_version": "fixture-normalizer-1.0.0",
      "confidence": 1.0
    }
  },
  "normalization_version": "1.0.0",
  "normalized_at": "2026-01-15T04:00:00Z"
}
