{
  "schema_version": "1.0.0",
  "contract_id": "contract_fixture_cancelled",
  "source_document_ids": ["srcdoc_fixture_cancelled"],
  "contract_number": "SYN-CANCELLED",
  "notice_id": "notice_fixture_cancelled",
  "award_id": "award_fixture_cancelled",
  "agency": {
    "agency_id": "agency_fixture_sandeul",
    "name": "가상산들군청",
    "identity_status": "VERIFIED"
  },
  "supplier": {
    "supplier_id": "supplier_fixture_zeta",
    "name": "가상제타",
    "entity_type": "CORPORATION",
    "identity_status": "VERIFIED",
    "business_number_last4": "0001"
  },
  "contract_type": "GOODS",
  "method": "OPEN_COMPETITION",
  "method_basis": "합성 fixture의 계약 방법 설명",
  "signed_at": "2025-07-18",
  "starts_at": "2025-07-18",
  "ends_at": "2026-05-31",
  "status": "CANCELLED",
  "amounts": {
    "original": {
      "currency": "KRW",
      "amount_minor": 26000000,
      "vat_basis": "INCLUDED"
    },
    "current": {
      "currency": "KRW",
      "amount_minor": 26000000,
      "vat_basis": "INCLUDED"
    }
  },
  "line_items": [
    {
      "line_item_id": "line_fixture_cancelled_1",
      "line_number": 1,
      "raw_description": "합성 안전 단말기 S1",
      "category_code": "SYNTH-SAFETY-DEVICE",
      "manufacturer": "가상제조사",
      "model": "S1",
      "variant": null,
      "quantity": "10",
      "unit_code": "EA",
      "unit_price": {
        "currency": "KRW",
        "amount_minor": 2600000,
        "vat_basis": "INCLUDED"
      },
      "total_price": {
        "currency": "KRW",
        "amount_minor": 26000000,
        "vat_basis": "INCLUDED"
      },
      "vat_basis": "INCLUDED",
      "bundle_status": "SINGLE_ITEM",
      "specification": {
        "grade": "S1",
        "synthetic": true
      },
      "included_services": [],
      "normalization_confidence": 0.99
    }
  ],
  "field_provenance": {
    "contract_number": {
      "source_document_id": "srcdoc_fixture_cancelled",
      "locator": {
        "type": "API_FIELD",
        "value": "$.contractNumber"
      },
      "raw_value_hash": "b1a7dded998ceb276067044da643f27e0dccc7bd72f9b6548b8704aaf6b4d2b0",
      "raw_value_preview": "SYN-CANCELLED",
      "parser_version": "fixture-parser-1.0.0",
      "transform_version": "fixture-normalizer-1.0.0",
      "confidence": 1.0
    },
    "agency.name": {
      "source_document_id": "srcdoc_fixture_cancelled",
      "locator": {
        "type": "API_FIELD",
        "value": "$.agencyName"
      },
      "raw_value_hash": "a95ebb1058696fe8b79f52c4420ef2887705dcc8f3a3c63035a2e35e25adacd2",
      "raw_value_preview": "가상산들군청",
      "parser_version": "fixture-parser-1.0.0",
      "transform_version": "fixture-normalizer-1.0.0",
      "confidence": 1.0
    },
    "supplier.name": {
      "source_document_id": "srcdoc_fixture_cancelled",
      "locator": {
        "type": "API_FIELD",
        "value": "$.supplierName"
      },
      "raw_value_hash": "aa7f30c333d176d9692915640c7c70ab1905218684787c6783bb430eec34d30c",
      "raw_value_preview": "가상제타",
      "parser_version": "fixture-parser-1.0.0",
      "transform_version": "fixture-normalizer-1.0.0",
      "confidence": 1.0
    },
    "amounts.current": {
      "source_document_id": "srcdoc_fixture_cancelled",
      "locator": {
        "type": "API_FIELD",
        "value": "$.amount"
      },
      "raw_value_hash": "bccc4278f07b60e723cc8bdf4e788926266aef71dfef7bac0daefef4e1d20257",
      "raw_value_preview": "26000000",
      "parser_version": "fixture-parser-1.0.0",
      "transform_version": "fixture-normalizer-1.0.0",
      "confidence": 1.0
    },
    "line_items[0].quantity": {
      "source_document_id": "srcdoc_fixture_cancelled",
      "locator": {
        "type": "API_FIELD",
        "value": "$.items[0].quantity"
      },
      "raw_value_hash": "4a44dc15364204a80fe80e9039455cc1608281820fe2b24f1e5233ade6af1dd5",
      "raw_value_preview": "10",
      "parser_version": "fixture-parser-1.0.0",
      "transform_version": "fixture-normalizer-1.0.0",
      "confidence": 1.0
    },
    "line_items[0].unit_price": {
      "source_document_id": "srcdoc_fixture_cancelled",
      "locator": {
        "type": "API_FIELD",
        "value": "$.items[0].unitPrice"
      },
      "raw_value_hash": "b18f692945847d49cdbfa738b9dec9199b7d2e81e3b4b1198096facf09c2f876",
      "raw_value_preview": "2600000",
      "parser_version": "fixture-parser-1.0.0",
      "transform_version": "fixture-normalizer-1.0.0",
      "confidence": 1.0
    },
    "line_items[0].vat_basis": {
      "source_document_id": "srcdoc_fixture_cancelled",
      "locator": {
        "type": "API_FIELD",
        "value": "$.items[0].vatBasis"
      },
      "raw_value_hash": "c77a4910d506fabde27cc281a5a48ed9e9a8f75f721eac77918ab30a3181b2be",
      "raw_value_preview": "INCLUDED",
      "parser_version": "fixture-parser-1.0.0",
      "transform_version": "fixture-normalizer-1.0.0",
      "confidence": 1.0
    }
  },
  "normalization_version": "1.0.0",
  "normalized_at": "2026-01-15T04:00:00Z"
}
